{"approval_audit":{"approved_for_export":true,"authorization_evidence_opaque_reference":"auth_wave1_synthetic_001","authorization_verified":true,"candidate_hash":"6027337da976411cab4f5f962db98b832174b492cee1472db074be581a12f1e6","created_at":"2026-08-04T16:00:00.000Z","reviewer_role":"owner","sanitization_reviewed":true,"source_hashes":[{"kind":"sanitized_projection","sha256":"fedfea56ce0e9ad59527a8179c3049af67d998a8ac7974016137d99a04ce5abb"},{"kind":"approved_asset","sha256":"9af913aa6d16e6c2ecb0c6fd3df4bed99192b8f59cc7618aab4f698b1f28b84a"}],"updated_at":"2026-08-04T16:00:00.000Z"},"assets":[{"alt_text":"彰化 Toyota VIOS 智慧鑰匙全丟合成案例示意圖","asset_id":"asset_wave1_synthetic_vios","height":630,"metadata_inspection":"passed_no_exif_gps","mime":"image/svg+xml","public_use_approval_status":"approved_synthetic","relative_package_path":"assets/synthetic-toyota-vios-case.svg","sanitization_status":"sanitized","sha256":"9af913aa6d16e6c2ecb0c6fd3df4bed99192b8f59cc7618aab4f698b1f28b84a","width":1200}],"candidate_hash":"6027337da976411cab4f5f962db98b832174b492cee1472db074be581a12f1e6","candidate_id":"cpc_6027337da976411c","candidate_revision":1,"candidate_status":"approved_for_export","carkey_owned_result":{"canonical_url":null,"deployment_id":null,"final_schema":"pending","final_slug":null,"publication_date":null,"published_commit":null,"published_url":null,"sitemap_entry":"pending"},"contract_version":"1.0.0","locale":"zh-TW","proposed_public_copy":{"cta_intent":"provide_vehicle_details_for_assessment","proposed_description":"彰化 2019 Toyota VIOS 智慧鑰匙全丟合成案例，依車款、年份、鑰匙型式與現場條件評估，完成後再依實車配備確認功能。","proposed_slug":"article-toyota-vios-2019-changhua-akl-wave1","proposed_title":"彰化 2019 Toyota VIOS 智慧鑰匙全丟處理案例｜極致核心 ProCore","public_safe_facts":["車款與年份為 2019 Toyota VIOS。","鑰匙狀況為手邊沒有可用的智慧鑰匙。","位置僅保留彰化縣層級的概略資訊。","完成後需依實車配備確認功能。"],"safety_note":"實際服務須先確認車主授權、實車狀態與現場條件；公開內容不提供車輛安全系統操作細節。","sanitized_narrative":"這筆純合成案例模擬車主在彰化縣概略區域遇到 2019 Toyota VIOS 智慧鑰匙全丟。聯絡前可先整理車款、年份、所在地與鑰匙狀況；實際安排仍須依車款、年份、鑰匙型式、實車狀態與現場條件確認。完成後依實車配備確認功能，公開草稿不包含精確位置、個人資料或可操作的車輛安全技術細節。","sanitized_summary":"彰化縣概略區域的 2019 Toyota VIOS 智慧鑰匙全丟合成案例，先確認車況與現場條件再評估處理方式。"},"source_case_opaque_reference":"scp_wave1_synthetic_001","source_system":"casepilot-automotive","synthetic":true,"target_system":"carkey.com.tw","taxonomy":{"content_type":"public_case","generalized_city_county":"彰化縣","generalized_scene":"repair_shop","key_situation":"smart_key_lost","model_year":2019,"related_existing_service_route":"/all-keys-lost-service","remaining_key_state":"none","service_scenario":"all_keys_lost","suggested_existing_internal_links":["/cases","/all-keys-lost-service","/toyota-altis-car-key"],"vehicle_brand":"Toyota","vehicle_model":"VIOS"}}
